Item Title,Publication Title,Book Series Title,Journal Volume,Journal Issue,Item DOI,Authors,Publication Year,URL,Content Type
"Fundamentals of Clinical Data Science","","","","","10.1007/978-3-319-99713-1","Dr. Pieter KubbenMichel DumontierProf. Dr. Andre Dekker","2019","http://link.springer.com/book/10.1007/978-3-319-99713-1","Book"
"Medienraum Diaspora","Neue Perspektiven der Medienästhetik","","","","10.1007/978-3-658-24606-8","Alena Strohmaier","2019","http://link.springer.com/book/10.1007/978-3-658-24606-8","Book"
"The Pangenome","","","","","10.1007/978-3-030-38281-0","Dr. Hervé TettelinDuccio Medini","2020","http://link.springer.com/book/10.1007/978-3-030-38281-0","Book"
"Ukrainian Migration to the European Union","IMISCOE Research Series","","","","10.1007/978-3-319-41776-9","Olena FedyukMarta Kindler","2016","http://link.springer.com/book/10.1007/978-3-319-41776-9","Book"
"The Cold War in the Classroom","Palgrave Studies in Educational Media","","","","10.1007/978-3-030-11999-7","Dr. Barbara ChristopheProf. Dr. Peter GautschiDr. Robert Thorp","2019","http://link.springer.com/book/10.1007/978-3-030-11999-7","Book"
"Collider Physics within the Standard Model","Lecture Notes in Physics","","","","10.1007/978-3-319-51920-3","James Wells","2017","http://link.springer.com/book/10.1007/978-3-319-51920-3","Book"
"Safety Cultures, Safety Models","SpringerBriefs in Applied Sciences and Technology","","","","10.1007/978-3-319-95129-4","Dr. Claude GilbertBenoît JournéHervé LarocheCorinne Bieder","2018","http://link.springer.com/book/10.1007/978-3-319-95129-4","Book"
"Balanced Urban Development: Options and Strategies for Liveable Cities","Water Science and Technology Library","","","","10.1007/978-3-319-28112-4","Basant MaheshwariVijay P. SinghBhadranie Thoradeniya","2016","http://link.springer.com/book/10.1007/978-3-319-28112-4","Book"
"Computational Conflict Research","Computational Social Sciences","","","","10.1007/978-3-030-29333-8","Emanuel DeutschmannDr. Jan LorenzLuis G. NardinDavide NataliniProf. Dr. Adalbert F. X. Wilhelm","2020","http://link.springer.com/book/10.1007/978-3-030-29333-8","Book"
"Public Health Ethics: Cases Spanning the Globe","Public Health Ethics Analysis","","","","10.1007/978-3-319-23847-0","Drue H. BarrettLeonard W. OrtmannAngus DawsonCarla SaenzAndreas ReisGail Bolan","2016","http://link.springer.com/book/10.1007/978-3-319-23847-0","Book"
"Beyond Safety Training","SpringerBriefs in Applied Sciences and Technology","","","","10.1007/978-3-319-65527-7","Corinne BiederClaude GilbertBenoît JournéHervé Laroche","2018","http://link.springer.com/book/10.1007/978-3-319-65527-7","Book"
"Computer Aided Verification","Lecture Notes in Computer Science","","","","10.1007/978-3-030-25543-5","Isil DilligSerdar Tasiran","2019","http://link.springer.com/book/10.1007/978-3-030-25543-5","Book"
"Ecological Risk Assessment for Chlorpyrifos in Terrestrial and Aquatic Systems in the United States","Reviews of Environmental Contamination and Toxicology","","","","10.1007/978-3-319-03865-0","John P. GiesyKeith R. Solomon","2014","http://link.springer.com/book/10.1007/978-3-319-03865-0","Book"
"Social and Political Dimensions of Mathematics Education","ICME-13 Topical Surveys","","","","10.1007/978-3-319-29655-5","Murad JurdakRenuka VithalElizabeth de FreitasPeter GatesDavid Kollosche","2016","http://link.springer.com/book/10.1007/978-3-319-29655-5","Book"
"Punishing the Criminal Corpse, 1700-1840","Palgrave Historical Studies in the Criminal Corpse and its Afterlife","","","","10.1057/978-1-137-51361-8","Peter King","2017","http://link.springer.com/book/10.1057/978-1-137-51361-8","Book"
"Rethinking the Internet of Things","","","","","10.1007/978-1-4302-5741-7","Francis daCosta","2013","http://link.springer.com/book/10.1007/978-1-4302-5741-7","Book"
"Marine Carbon Biogeochemistry","SpringerBriefs in Earth System Sciences","","","","10.1007/978-3-030-10822-9","Jack J. Middelburg","2019","http://link.springer.com/book/10.1007/978-3-030-10822-9","Book"
"Optics in Our Time","","","","","10.1007/978-3-319-31903-2","Mohammad D. Al-AmriMohamed El-GomatiM. Suhail Zubairy","2016","http://link.springer.com/book/10.1007/978-3-319-31903-2","Book"
"The Pathologisation of Homosexuality in Fascist Italy","Genders and Sexualities in History","","","","10.1007/978-3-030-00994-6","Gabriella Romano","2019","http://link.springer.com/book/10.1007/978-3-030-00994-6","Book"
"Corporate Data Quality","","","","","10.1007/978-3-662-46806-7","Boris OttoHubert Österle","2016","http://link.springer.com/book/10.1007/978-3-662-46806-7","Book"
"Do Exclusionary Rules Ensure a Fair Trial?","Ius Gentium: Comparative Perspectives on Law and Justice","","","","10.1007/978-3-030-12520-2","Dr. Sabine GlessDr. Thomas Richter","2019","http://link.springer.com/book/10.1007/978-3-030-12520-2","Book"
"Gestaltung sozialer Versorgung","","","","","10.1007/978-3-658-24374-6","Prof. Dr. Jürgen StremlowWerner RiedwegHerbert Bürgisser","2019","http://link.springer.com/book/10.1007/978-3-658-24374-6","Book"
"Agricultural and Forestry Reconstruction After the Great East Japan Earthquake","","","","","10.1007/978-4-431-55558-2","Toshiyuki MonmaItsuo GotoTakahisa HayashiHidekiyo TachiyaKanju Ohsawa","2015","http://link.springer.com/book/10.1007/978-4-431-55558-2","Book"
"Affect and Mathematics Education","ICME-13 Monographs","","","","10.1007/978-3-030-13761-8","Markku S. HannulaGilah C. LederFrancesca MorselliMaike VollstedtQiaoping Zhang","2019","http://link.springer.com/book/10.1007/978-3-030-13761-8","Book"
"Demystifying Internet of Things Security","","","","","10.1007/978-1-4842-2896-8","Sunil CheruvuAnil KumarNed SmithDavid M. Wheeler","2020","http://link.springer.com/book/10.1007/978-1-4842-2896-8","Book"
"Psychiatry and Decolonisation in Uganda","Mental Health in Historical Perspective","","","","10.1057/978-1-137-60095-0","Yolana Pringle","2019","http://link.springer.com/book/10.1057/978-1-137-60095-0","Book"
"Norwegian Shipping in the 20th Century","Palgrave Studies in Maritime Economics","","","","10.1007/978-3-319-95639-8","Stig Tenold","2019","http://link.springer.com/book/10.1007/978-3-319-95639-8","Book"
"Geographies of Asylum in Europe and the Role of European Localities","IMISCOE Research Series","","","","10.1007/978-3-030-25666-1","Prof. Dr. Birgit GloriusDr. Jeroen Doomernik","2020","http://link.springer.com/book/10.1007/978-3-030-25666-1","Book"
"Fashion Figures","","","","","10.1007/978-1-4842-2274-4","Melissa A. Borza","2017","http://link.springer.com/book/10.1007/978-1-4842-2274-4","Book"
"Language Technologies for the Challenges of the Digital Age","Lecture Notes in Computer Science","","","","10.1007/978-3-319-73706-5","Dr. Georg RehmThierry Declerck","2018","http://link.springer.com/book/10.1007/978-3-319-73706-5","Book"
"Promoting Social Dialogue in European Organizations","Industrial Relations & Conflict Management","","","","10.1007/978-3-319-08605-7","Martin EuwemaLourdes MunduatePatricia ElgoibarErica PenderAna Belén García","2015","http://link.springer.com/book/10.1007/978-3-319-08605-7","Book"
"Intel® Trusted Execution Technology for Server Platforms","","","","","10.1007/978-1-4302-6149-0","William FutralJames Greene","2013","http://link.springer.com/book/10.1007/978-1-4302-6149-0","Book"
"Play-Responsive Teaching in Early Childhood Education","International Perspectives on Early Childhood Education and Development","","","","10.1007/978-3-030-15958-0","Niklas PramlingCecilia WallerstedtPernilla LagerlöfCamilla BjörklundAnne KulttiDr. Hanna PalmérMaria MagnussonSusanne ThulinAgneta JonssonProf. Ingrid Pramling Samuelsson","2019","http://link.springer.com/book/10.1007/978-3-030-15958-0","Book"
"Obsessed by a Dream","Springer Biographies","","","","10.1007/978-3-030-26338-6","Dr. Aashild Sørheim","2020","http://link.springer.com/book/10.1007/978-3-030-26338-6","Book"
"Martin Waldseemüller’s 'Carta marina' of 1516","","","","","10.1007/978-3-030-22703-6","Chet Van Duzer","2020","http://link.springer.com/book/10.1007/978-3-030-22703-6","Book"
"Intel® Galileo and Intel® Galileo Gen 2","","","","","10.1007/978-1-4302-6838-3","Manoel Carlos Ramon","2014","http://link.springer.com/book/10.1007/978-1-4302-6838-3","Book"
"Narrating China's Governance","","","","","10.1007/978-981-32-9178-2","Department of Commentary People's Daily","2020","http://link.springer.com/book/10.1007/978-981-32-9178-2","Book"
"Between Mobility and Migration","IMISCOE Research Series","","","","10.1007/978-3-319-77991-1","Dr. Peter ScholtenDr. Mark van Ostaijen","2018","http://link.springer.com/book/10.1007/978-3-319-77991-1","Book"
"Purpose-driven Organizations","","","","","10.1007/978-3-030-17674-7","Carlos ReyMiquel BastonsPhil Sotok","2019","http://link.springer.com/book/10.1007/978-3-030-17674-7","Book"
"Boundary Value Problems, Weyl Functions, and Differential Operators","Monographs in Mathematics","","","","10.1007/978-3-030-36714-5","Jussi BehrndtSeppo HassiHenk de Snoo","2020","http://link.springer.com/book/10.1007/978-3-030-36714-5","Book"
"Ethics and Civil Drones","SpringerBriefs in Law","","","","10.1007/978-3-319-71087-7","Prof. Dr. María de Miguel MolinaProf. Dr. Virginia Santamarina Campos","2018","http://link.springer.com/book/10.1007/978-3-319-71087-7","Book"
"Technological and Institutional Innovations for Marginalized Smallholders in Agricultural Development","","","","","10.1007/978-3-319-25718-1","Franz W. GatzweilerJoachim von Braun","2016","http://link.springer.com/book/10.1007/978-3-319-25718-1","Book"
"Rangeland Systems","Springer Series on Environmental Management","","","","10.1007/978-3-319-46709-2","David D. Briske","2017","http://link.springer.com/book/10.1007/978-3-319-46709-2","Book"
"Building the Infrastructure for Cloud Security","","","","","10.1007/978-1-4302-6146-9","Raghu YeluriEnrique Castro-Leon","2014","http://link.springer.com/book/10.1007/978-1-4302-6146-9","Book"
"Building the Foundation: Whole Numbers in the Primary Grades","New ICMI Study Series","","","","10.1007/978-3-319-63555-2","Maria G. Bartolini BussiXu Hua Sun","2018","http://link.springer.com/book/10.1007/978-3-319-63555-2","Book"
"Perspectives on European Earthquake Engineering and Seismology","Geotechnical, Geological and Earthquake Engineering","","","","10.1007/978-3-319-07118-3","Atilla Ansal","2014","http://link.springer.com/book/10.1007/978-3-319-07118-3","Book"
"Sensitivity Analysis: Matrix Methods in Demography and Ecology","Demographic Research Monographs","","","","10.1007/978-3-030-10534-1","Prof. Hal Caswell","2019","http://link.springer.com/book/10.1007/978-3-030-10534-1","Book"
"Security of Networks and Services in an All-Connected World","Lecture Notes in Computer Science","","","","10.1007/978-3-319-60774-0","Daphne TuncerRobert KochRémi BadonnelProf. Dr. Burkhard Stiller","2017","http://link.springer.com/book/10.1007/978-3-319-60774-0","Book"
"Children's Exploration and Cultural Formation","International Perspectives on Early Childhood Education and Development","","","","10.1007/978-3-030-36271-3","Mariane HedegaardElin Eriksen Ødegaard","2020","http://link.springer.com/book/10.1007/978-3-030-36271-3","Book"
"Agile Processes in Software Engineering and Extreme Programming – Workshops","Lecture Notes in Business Information Processing","","","","10.1007/978-3-030-30126-2","Dr. Rashina Hoda","2019","http://link.springer.com/book/10.1007/978-3-030-30126-2","Book"
"Fundamental Approaches to Software Engineering","Lecture Notes in Computer Science","","","","10.1007/978-3-030-45234-6","Prof. Heike WehrheimProf. Jordi Cabot","2020","http://link.springer.com/book/10.1007/978-3-030-45234-6","Book"
"Programming Languages and Systems","Lecture Notes in Computer Science","","","","10.1007/978-3-030-44914-8","Prof. Dr. Peter Müller","2020","http://link.springer.com/book/10.1007/978-3-030-44914-8","Book"
"DevOps for Digital Leaders","","","","","10.1007/978-1-4842-1842-6","Aruna RavichandranKieran TaylorPeter Waterhouse","2016","http://link.springer.com/book/10.1007/978-1-4842-1842-6","Book"
"Model-Driven Development and Operation of Multi-Cloud Applications","SpringerBriefs in Applied Sciences and Technology","","","","10.1007/978-3-319-46031-4","Elisabetta Di NittoPeter MatthewsDana PetcuArnor Solberg","2017","http://link.springer.com/book/10.1007/978-3-319-46031-4","Book"
"Tools and Algorithms for the Construction and Analysis of Systems","Lecture Notes in Computer Science","","","","10.1007/978-3-319-89960-2","Prof. Dr. Dirk BeyerProf. Dr. Marieke Huisman","2018","http://link.springer.com/book/10.1007/978-3-319-89960-2","Book"
"Buildings for Education","Research for Development","","","","10.1007/978-3-030-33687-5","Prof. Stefano Della TorreProf. Massimiliano BocciarelliLaura DaglioRaffaella Neri","2020","http://link.springer.com/book/10.1007/978-3-030-33687-5","Book"
"Principles and Practice of Case-based Clinical Reasoning Education","Innovation and Change in Professional Education","","","","10.1007/978-3-319-64828-6","Ph.D. Olle ten CatePh.D. Eugène J.F.M. CustersPh.D. Steven J. Durning","2018","http://link.springer.com/book/10.1007/978-3-319-64828-6","Book"
"Africa-Europe Research and Innovation Cooperation","","","","","10.1007/978-3-319-69929-5","Andrew CherryJames HaselipGerard RalphsIsabella E. Wagner","2018","http://link.springer.com/book/10.1007/978-3-319-69929-5","Book"
"Housing Estates in Europe","The Urban Book Series","","","","10.1007/978-3-319-92813-5","Dr. Daniel Baldwin HessDr. Tiit TammaruProf. Dr. Maarten van Ham","2018","http://link.springer.com/book/10.1007/978-3-319-92813-5","Book"
"Illustrated Pollen Terminology","","","","","10.1007/978-3-319-71365-6","Dr. Dr. Heidemarie HalbritterDr. Silvia UlrichDr. Friðgeir GrímssonProf. Dr. Martina WeberProf. Dr. Reinhard ZetterProf. Dr. Michael HesseDr. Ralf BuchnerMag. Matthias SvojtkaAndrea Frosch-Radivo","2018","http://link.springer.com/book/10.1007/978-3-319-71365-6","Book"
"Semantic Systems. The Power of AI and Knowledge Graphs","Lecture Notes in Computer Science","","","","10.1007/978-3-030-33220-4","Maribel AcostaPhilippe Cudré-MaurouxMaria MaleshkovaProf. Dr. Tassilo PellegriniDr. Harald SackProf. Dr. York Sure-Vetter","2019","http://link.springer.com/book/10.1007/978-3-030-33220-4","Book"
"Collective Actions in Europe","SpringerBriefs in Law","","","","10.1007/978-3-030-24222-0","Prof. Dr. Csongor István Nagy","2019","http://link.springer.com/book/10.1007/978-3-030-24222-0","Book"
"Housing Estates in the Baltic Countries","The Urban Book Series","","","","10.1007/978-3-030-23392-1","Dr. Daniel Baldwin HessDr. Tiit Tammaru","2019","http://link.springer.com/book/10.1007/978-3-030-23392-1","Book"
"Dynamic Spectrum Management","Signals and Communication Technology","","","","10.1007/978-981-15-0776-2","Ying-Chang Liang","2020","http://link.springer.com/book/10.1007/978-981-15-0776-2","Book"
"Los Angeles and the Summer Olympic Games","SpringerBriefs in Geography","","","","10.1007/978-3-030-38553-8","Assoc. Prof. Eva Kassens Noor","2020","http://link.springer.com/book/10.1007/978-3-030-38553-8","Book"
"Cosmic Ray Neutron Sensing:  Estimation of Agricultural Crop Biomass Water Equivalent","","","","","10.1007/978-3-319-69539-6","Dr. Ammar WahbiLee HengDr. Gerd Dercon","2018","http://link.springer.com/book/10.1007/978-3-319-69539-6","Book"
"Working, Housing: Urbanizing","SpringerBriefs in Global Understanding","","","","10.1007/978-3-319-45180-0","Jennifer RobinsonAllen J. ScottPeter J. Taylor","2016","http://link.springer.com/book/10.1007/978-3-319-45180-0","Book"
"Nanoinformatics","","","","","10.1007/978-981-10-7617-6","Prof. Dr. Isao Tanaka","2018","http://link.springer.com/book/10.1007/978-981-10-7617-6","Book"
"Between Psychology and Philosophy","Palgrave Studies in Comparative East-West Philosophy","","","","10.1007/978-3-030-22503-2","Prof. Michael Slote","2020","http://link.springer.com/book/10.1007/978-3-030-22503-2","Book"
"From Assessing to Conserving Biodiversity","History, Philosophy and Theory of the Life Sciences","","","","10.1007/978-3-030-10991-2","Dr. Elena CasettaDr. Jorge Marques da SilvaDr. Davide Vecchi","2019","http://link.springer.com/book/10.1007/978-3-030-10991-2","Book"
"Implementation of EU Readmission Agreements","SpringerBriefs in Law","","","","10.1007/978-3-319-42505-4","Sergio Carrera","2016","http://link.springer.com/book/10.1007/978-3-319-42505-4","Book"
"Programming for Computations - Python","Texts in Computational Science and Engineering","","","","10.1007/978-3-319-32428-9","Svein LingeHans Petter Langtangen","2016","http://link.springer.com/book/10.1007/978-3-319-32428-9","Book"
"The Golden and Ghoulish Age of the Gibbet in Britain","Palgrave Historical Studies in the Criminal Corpse and its Afterlife","","","","10.1057/978-1-137-60089-9","Sarah Tarlow","2017","http://link.springer.com/book/10.1057/978-1-137-60089-9","Book"
"The Cellular Automaton Interpretation of Quantum Mechanics","Fundamental Theories of Physics","","","","10.1007/978-3-319-41285-6","Gerard 't Hooft","2016","http://link.springer.com/book/10.1007/978-3-319-41285-6","Book"
"Air Quality Integrated Assessment","SpringerBriefs in Applied Sciences and Technology","","","","10.1007/978-3-319-33349-6","Giorgio GuarisoMarialuisa Volta","2017","http://link.springer.com/book/10.1007/978-3-319-33349-6","Book"
"Transforming Food Systems for a Rising India","Palgrave Studies in Agricultural Economics and Food Policy","","","","10.1007/978-3-030-14409-8","Dr. Prabhu PingaliDr. Anaka AiyarDr. Mathew AbrahamDr. Andaleeb Rahman","2019","http://link.springer.com/book/10.1007/978-3-030-14409-8","Book"
"Childlessness in Europe: Contexts, Causes, and Consequences","Demographic Research Monographs","","","","10.1007/978-3-319-44667-7","Michaela KreyenfeldDirk Konietzka","2017","http://link.springer.com/book/10.1007/978-3-319-44667-7","Book"
"International Comparative Studies in Mathematics","ICME-13 Topical Surveys","","","","10.1007/978-3-319-42414-9","Jinfa CaiIda A.C. MokVijay ReddyKaye Stacey","2016","http://link.springer.com/book/10.1007/978-3-319-42414-9","Book"
"Becoming Citizens in a Changing World","","","","","10.1007/978-3-319-73963-2","Wolfram SchulzJohn AinleyJulian FraillonDr. Bruno LositoDr. Gabriella AgrustiTim Friedman","2018","http://link.springer.com/book/10.1007/978-3-319-73963-2","Book"
"P5 eHealth: An Agenda for the Health Technologies of the Future","","","","","10.1007/978-3-030-27994-3","Gabriella PravettoniStefano Triberti","2020","http://link.springer.com/book/10.1007/978-3-030-27994-3","Book"
"White-Collar Crime in the Shadow Economy","","","","","10.1007/978-3-319-75292-1","Prof. Petter GottschalkLars Gunnesdal","2018","http://link.springer.com/book/10.1007/978-3-319-75292-1","Book"
"Studies in Global Animal Law","Beiträge zum ausländischen öffentlichen Recht und Völkerrecht","","","","10.1007/978-3-662-60756-5","Prof. Dr. Anne Peters","2020","http://link.springer.com/book/10.1007/978-3-662-60756-5","Book"
"Status and Dynamics of Forests in Germany","Ecological Studies","","","","10.1007/978-3-030-15734-0","Dr. Nicole WellbrockAndreas Bolte","2019","http://link.springer.com/book/10.1007/978-3-030-15734-0","Book"
"Agency and Causal Explanation in Economics","Virtues and Economics","","","","10.1007/978-3-030-26114-6","Peter RónaLászló Zsolnai","2020","http://link.springer.com/book/10.1007/978-3-030-26114-6","Book"
"Human and Organisational Factors","SpringerBriefs in Applied Sciences and Technology","","","","10.1007/978-3-030-25639-5","Prof. Benoît JournéProf. Hervé LarocheDr. Corinne BiederDr. Claude Gilbert","2020","http://link.springer.com/book/10.1007/978-3-030-25639-5","Book"
"The Future of Transport Between Digitalization and Decarbonization","SpringerBriefs in Energy","","","","10.1007/978-3-030-37966-7","Dr. Michel NoussanProf. Dr. Manfred HafnerDr. Simone Tagliapietra","2020","http://link.springer.com/book/10.1007/978-3-030-37966-7","Book"
"Communicative Figurations","Transforming Communications – Studies in Cross-Media Research","","","","10.1007/978-3-319-65584-0","Andreas HeppProf. Dr. Andreas BreiterProf. Dr. Uwe Hasebrink","2018","http://link.springer.com/book/10.1007/978-3-319-65584-0","Book"
"Migrants and Expats: The Swiss Migration and Mobility Nexus","IMISCOE Research Series","","","","10.1007/978-3-030-05671-1","Dr. Ilka SteinerProf. Philippe Wanner","2019","http://link.springer.com/book/10.1007/978-3-030-05671-1","Book"
"Education for Children with Disabilities in Addis Ababa, Ethiopia","Inclusive Learning and Educational Equity","","","","10.1007/978-3-319-60768-9","Dr. Margarita Schiemer","2017","http://link.springer.com/book/10.1007/978-3-319-60768-9","Book"
"Designing Sustainable Energy for All","Green Energy and Technology","","","","10.1007/978-3-319-70223-0","Prof. Carlo VezzoliDr. Fabrizio CeschinLilac OsanjoProf. Mugendi K. M’RithaaDr. Richie MoalosiDr. Venny NakazibweJan Carel Diehl","2018","http://link.springer.com/book/10.1007/978-3-319-70223-0","Book"
"The Ethics of Cybersecurity","The International Library of Ethics, Law and Technology","","","","10.1007/978-3-030-29053-5","Dr. Markus ChristenDr. Bert GordijnDr. Michele Loi","2020","http://link.springer.com/book/10.1007/978-3-030-29053-5","Book"
"Research, Ethics and Risk in the Authoritarian Field","","","","","10.1007/978-3-319-68966-1","Dr. Marlies GlasiusMeta de LangeJos BartmanEmanuela DalmassoAofei LvDr. Adele Del SordiMarcus MichaelsenKris Ruijgrok","2018","http://link.springer.com/book/10.1007/978-3-319-68966-1","Book"
"Psychometric Framework for Modeling Parental Involvement and Reading Literacy","IEA Research for Education","","","","10.1007/978-3-319-28064-6","Annemiek PunterCees A. W. GlasMartina R. M. Meelissen","2016","http://link.springer.com/book/10.1007/978-3-319-28064-6","Book"
"Diversity and Evolution of Butterfly Wing Patterns","","","","","10.1007/978-981-10-4956-9","Dr. Toshio SekimuraDr. H. Frederik Nijhout","2017","http://link.springer.com/book/10.1007/978-981-10-4956-9","Book"
"Curriculum Reform in the European Schools","","","","","10.1007/978-3-319-71464-6","Sandra Leaton GrayProf. David ScottPeeter Mehisto","2018","http://link.springer.com/book/10.1007/978-3-319-71464-6","Book"
"A Life Course Perspective on Health Trajectories and Transitions","Life Course Research and Social Policies","","","","10.1007/978-3-319-20484-0","Claudine Burton-JeangrosStéphane CullatiAmanda SackerDavid Blane","2015","http://link.springer.com/book/10.1007/978-3-319-20484-0","Book"
"Pflegeroboter","","","","","10.1007/978-3-658-22698-5","Prof. Dr. Oliver Bendel","2018","http://link.springer.com/book/10.1007/978-3-658-22698-5","Book"
"Riverine Ecosystem Management","Aquatic Ecology Series","","","","10.1007/978-3-319-73250-3","Prof. Dr. Stefan SchmutzDr. Jan Sendzimir","2018","http://link.springer.com/book/10.1007/978-3-319-73250-3","Book"
"Principles of Security and Trust","Lecture Notes in Computer Science","","","","10.1007/978-3-319-89722-6","Lujo BauerRalf Küsters","2018","http://link.springer.com/book/10.1007/978-3-319-89722-6","Book"
"Sexual Reproduction in Animals and Plants","","","","","10.1007/978-4-431-54589-7","Hitoshi SawadaNaokazu InoueMegumi Iwano","2014","http://link.springer.com/book/10.1007/978-4-431-54589-7","Book"
"Elements of Robotics","","","","","10.1007/978-3-319-62533-1","Prof. Mordechai Ben-AriProf. Dr. Francesco Mondada","2018","http://link.springer.com/book/10.1007/978-3-319-62533-1","Book"
"Building the Inclusive City","","","","","10.1007/978-3-030-32988-4","Dr. Victor Santiago Pineda","2020","http://link.springer.com/book/10.1007/978-3-030-32988-4","Book"
"Creating Healthy and Sustainable Buildings","","","","","10.1007/978-3-030-19412-3","Dr. Mateja DovjakAssist. Prof. Andreja Kukec","2019","http://link.springer.com/book/10.1007/978-3-030-19412-3","Book"
"Shipping and Globalization in the Post-War Era","Palgrave Studies in Maritime Economics","","","","10.1007/978-3-030-26002-6","Prof. Niels P. PeterssonProf. Stig TenoldNicholas J. White","2019","http://link.springer.com/book/10.1007/978-3-030-26002-6","Book"
"Early Public Libraries and Colonial Citizenship in the British Southern Hemisphere","New Directions in Book History","","","","10.1007/978-3-030-20426-6","Lara AtkinDr. Sarah ComynPorscha FermanisNathan Garvey","2019","http://link.springer.com/book/10.1007/978-3-030-20426-6","Book"
"Wellbeing and Devolution","Wellbeing in Politics and Policy","","","","10.1007/978-3-030-02230-3","Dr. Jennifer Wallace","2019","http://link.springer.com/book/10.1007/978-3-030-02230-3","Book"
"Lewis Fry Richardson: His Intellectual Legacy and Influence in the Social Sciences","Pioneers in Arts, Humanities, Science, Engineering, Practice","","","","10.1007/978-3-030-31589-4","Prof. Nils Petter Gleditsch","2020","http://link.springer.com/book/10.1007/978-3-030-31589-4","Book"
"Nachhaltigkeit in Umwelt, Wirtschaft und Gesellschaft","","","","","10.1007/978-3-658-14439-5","Klaus-Dieter AltmeppenFrank ZschalerHans-Martin ZademachChristoph BöttigheimerMarkus Müller","2017","http://link.springer.com/book/10.1007/978-3-658-14439-5","Book"
"Inquiry-Based Learning – Undergraduate Research","","","","","10.1007/978-3-030-14223-0","Harald A. Mieg","2019","http://link.springer.com/book/10.1007/978-3-030-14223-0","Book"
"Reality Lost","","","","","10.1007/978-3-030-00813-0","Vincent F. HendricksMads Vestergaard","2019","http://link.springer.com/book/10.1007/978-3-030-00813-0","Book"
"Society - Water - Technology","Water Resources Development and Management","","","","10.1007/978-3-319-18971-0","Reinhard F. HüttlOliver BensChristine BismuthSebastian Hoechstetter","2016","http://link.springer.com/book/10.1007/978-3-319-18971-0","Book"
