Item Title,Publication Title,Book Series Title,Journal Volume,Journal Issue,Item DOI,Authors,Publication Year,URL,Content Type
"Make Life Visible","","","","","10.1007/978-981-13-7908-6","Prof. Yoshiaki ToyamaPh.D. Atsushi MiyawakiProf. Masaya NakamuraProf. Masahiro Jinzaki","2020","http://link.springer.com/book/10.1007/978-981-13-7908-6","Book"
"Cow Care in Hindu Animal Ethics","The Palgrave Macmillan Animal Ethics Series","","","","10.1007/978-3-030-28408-4","Dr. Kenneth R. Valpey","2020","http://link.springer.com/book/10.1007/978-3-030-28408-4","Book"
"Linear Selection Indices in Modern Plant Breeding","","","","","10.1007/978-3-319-91223-3","Dr. J. Jesus Céron-RojasJosé Crossa","2018","http://link.springer.com/book/10.1007/978-3-319-91223-3","Book"
"Technologies for Development","","","","","10.1007/978-3-319-91068-0","Prof. Dr. Silvia HostettlerSamira Najih BessonProf. Dr. Jean-Claude Bolay","2018","http://link.springer.com/book/10.1007/978-3-319-91068-0","Book"
"Models, Methods and Tools for Product Service Design","SpringerBriefs in Applied Sciences and Technology","","","","10.1007/978-3-319-95849-1","Dr. Laura CattaneoProf. Sergio Terzi","2019","http://link.springer.com/book/10.1007/978-3-319-95849-1","Book"
"Intercultural Dialogue in the European Education Policies","","","","","10.1007/978-3-030-41517-4","Dr. Tuuli LähdesmäkiDr. Aino-Kaisa KoistinenDr. Susanne C. Ylönen","2020","http://link.springer.com/book/10.1007/978-3-030-41517-4","Book"
"The Third Sector as a Renewable Resource for Europe","","","","","10.1007/978-3-319-71473-8","Bernard EnjolrasLester M. SalamonKarl Henrik SivesindAnnette Zimmer","2018","http://link.springer.com/book/10.1007/978-3-319-71473-8","Book"
"A Philosophical Examination of Social Justice and Child Poverty","","","","","10.1057/9781137426024","Gottfried SchweigerGunter Graf","2015","http://link.springer.com/book/10.1057/9781137426024","Book"
"Disrupting Finance","Palgrave Studies in Digital Business & Enabling Technologies","","","","10.1007/978-3-030-02330-0","Theo LynnProf. John G. MooneyDr. Pierangelo RosatiProf. Mark Cummins","2019","http://link.springer.com/book/10.1007/978-3-030-02330-0","Book"
"Principles of Mechanics","Advances in Science, Technology & Innovation","","","","10.1007/978-3-030-15195-9","Salma Alrasheed","2019","http://link.springer.com/book/10.1007/978-3-030-15195-9","Book"
"West African Youth Challenges and Opportunity Pathways","Gender and Cultural Studies in Africa and the Diaspora","","","","10.1007/978-3-030-21092-2","Mora L. McLean","2020","http://link.springer.com/book/10.1007/978-3-030-21092-2","Book"
"Mediation in Collective Labor Conflicts","Industrial Relations & Conflict Management","","","","10.1007/978-3-319-92531-8","Prof. Martin C. EuwemaProf. Dr. Francisco J. MedinaDr. Ana Belén GarcíaDr. Erica Romero Pender","2019","http://link.springer.com/book/10.1007/978-3-319-92531-8","Book"
"Africa-EU Renewable Energy Research and Innovation Symposium 2018 (RERIS 2018)","Springer Proceedings in Energy","","","","10.1007/978-3-319-93438-9","Dr. Moeketsi MpholoDirk SteuerwaldTonny Kukeera","2018","http://link.springer.com/book/10.1007/978-3-319-93438-9","Book"
"Low-Cost Methods for Molecular Characterization of Mutant Plants","","","","","10.1007/978-3-319-16259-1","Bradley J. TillJoanna Jankowicz-CieslakOwen A. HuynhMayada M. BeshirRobert G. LaportBernhard J. Hofinger","2015","http://link.springer.com/book/10.1007/978-3-319-16259-1","Book"
"Asylum Determination in Europe","Palgrave Socio-Legal Studies","","","","10.1007/978-3-319-94749-5","Dr. Nick GillProf. Anthony Good","2019","http://link.springer.com/book/10.1007/978-3-319-94749-5","Book"
"Transdisziplinär und transformativ forschen","","","","","10.1007/978-3-658-21530-9","Dr. Antonietta Di GiulioRico Defila","2018","http://link.springer.com/book/10.1007/978-3-658-21530-9","Book"
"Data and Text Processing for Health and Life Sciences","Advances in Experimental Medicine and Biology","","","","10.1007/978-3-030-13845-5","Ph.D. Francisco M. Couto","2019","http://link.springer.com/book/10.1007/978-3-030-13845-5","Book"
"Teaching and Learning Mathematical Modelling","ICME-13 Topical Surveys","","","","10.1007/978-3-319-45004-9","Gilbert GreefrathKatrin Vorhölter","2016","http://link.springer.com/book/10.1007/978-3-319-45004-9","Book"
"Divorce in Europe","European Studies of Population","","","","10.1007/978-3-030-25838-2","Prof. Dimitri Mortelmans","2020","http://link.springer.com/book/10.1007/978-3-030-25838-2","Book"
"The Hindu Kush Himalaya Assessment","","","","","10.1007/978-3-319-92288-1","Dr. Philippus WesterDr. Arabinda MishraDr. Aditi MukherjiDr. Arun Bhakta Shrestha","2019","http://link.springer.com/book/10.1007/978-3-319-92288-1","Book"
"Computation and the Humanities","Springer Series on Cultural Computing","","","","10.1007/978-3-319-20170-2","Julianne NyhanAndrew Flinn","2016","http://link.springer.com/book/10.1007/978-3-319-20170-2","Book"
"The Privacy Engineer’s Manifesto","","","","","10.1007/978-1-4302-6356-2","Michelle Finneran DennedyJonathan FoxThomas R. Finneran","2014","http://link.springer.com/book/10.1007/978-1-4302-6356-2","Book"
"Agile Processes in Software Engineering and Extreme Programming","Lecture Notes in Business Information Processing","","","","10.1007/978-3-319-57633-6","Hubert BaumeisterHorst LichterMatthias Riebisch","2017","http://link.springer.com/book/10.1007/978-3-319-57633-6","Book"
"Computer Aided Verification","Lecture Notes in Computer Science","","","","10.1007/978-3-319-96145-3","Dr. Hana ChocklerGeorg Weissenbacher","2018","http://link.springer.com/book/10.1007/978-3-319-96145-3","Book"
"Das Blaue Buch","","","","","10.1007/978-3-662-51420-7","Prof. Dr. Monika EngelhardtProf. Dr. Dietmar P. BergerProf. Dr. Dr. h.c. Roland MertelsmannProf. Dr. Justus Duyster","2017","http://link.springer.com/book/10.1007/978-3-662-51420-7","Book"
"Cloud-Based Benchmarking of Medical Image Analysis","","","","","10.1007/978-3-319-49644-3","Allan HanburyHenning MüllerGeorg Langs","2017","http://link.springer.com/book/10.1007/978-3-319-49644-3","Book"
"The Poetics and Politics of Alzheimer’s Disease Life-Writing","Palgrave Studies in Literature, Science and Medicine","","","","10.1007/978-3-319-44388-1","Martina Zimmermann","2017","http://link.springer.com/book/10.1007/978-3-319-44388-1","Book"
"The Great Mindshift","The Anthropocene: Politik—Economics—Society—Science","","","","10.1007/978-3-319-43766-8","Maja Göpel","2016","http://link.springer.com/book/10.1007/978-3-319-43766-8","Book"
"Surveying Human Vulnerabilities across the Life Course","Life Course Research and Social Policies","","","","10.1007/978-3-319-24157-9","Dr. Michel OrisProf. Caroline RobertsProf. Dominique JoyeDr. Michèle Ernst Stähli","2016","http://link.springer.com/book/10.1007/978-3-319-24157-9","Book"
"Dignity in the 21st Century","SpringerBriefs in Philosophy","","","","10.1007/978-3-319-58020-3","Doris SchroederAbol‐Hassan Bani-Sadr","2017","http://link.springer.com/book/10.1007/978-3-319-58020-3","Book"
"Flexibel studieren – Vereinbarkeit ermöglichen","","","","","10.1007/978-3-658-26206-8","Imke Buß","2019","http://link.springer.com/book/10.1007/978-3-658-26206-8","Book"
"Contested Childhoods: Growing up in Migrancy","IMISCOE Research Series","","","","10.1007/978-3-319-44610-3","Marie Louise SeebergElżbieta M. Goździak","2016","http://link.springer.com/book/10.1007/978-3-319-44610-3","Book"
"How Generations Remember","Global Diversities","","","","10.1057/978-1-137-45063-0","Monika Palmberger","2016","http://link.springer.com/book/10.1057/978-1-137-45063-0","Book"
"Faith, Finance, and Economy","","","","","10.1007/978-3-030-38784-6","Ph.D. Tanweer AkramProf. Salim Rashid","2020","http://link.springer.com/book/10.1007/978-3-030-38784-6","Book"
"Regional and Local Development in Times of Polarisation","New Geographies of Europe","","","","10.1007/978-981-13-1190-1","Dr. Thilo LangDr. Franziska Görmar","2019","http://link.springer.com/book/10.1007/978-981-13-1190-1","Book"
"Buruli Ulcer","","","","","10.1007/978-3-030-11114-4","Prof. Dr. Gerd PluschkeDr. Katharina Röltgen","2019","http://link.springer.com/book/10.1007/978-3-030-11114-4","Book"
"Differential Undercounts in the U.S. Census","SpringerBriefs in Population Studies","","","","10.1007/978-3-030-10973-8","Dr. William P. O’Hare","2019","http://link.springer.com/book/10.1007/978-3-030-10973-8","Book"
"Scaling a Software Business","","","","","10.1007/978-3-319-53116-8","Prof. Brian FitzgeraldDr. Klaas-Jan StolDr. Sten MinörHenrik Cosmo","2017","http://link.springer.com/book/10.1007/978-3-319-53116-8","Book"
"Weißbuch Multiple Sklerose","","","","","10.1007/978-3-662-49204-8","Dr. med. M. KipDr. rer. medic. T. SchönfelderH.-H. Bleß","2016","http://link.springer.com/book/10.1007/978-3-662-49204-8","Book"
"Reflections on the Fukushima Daiichi Nuclear Accident","","","","","10.1007/978-3-319-12090-4","Joonhong AhnCathryn CarsonMikael JensenKohta JurakuShinya NagasakiSatoru Tanaka","2015","http://link.springer.com/book/10.1007/978-3-319-12090-4","Book"
"Planning for Ecosystem Services in Cities","SpringerBriefs in Environmental Science","","","","10.1007/978-3-030-20024-4","Davide GenelettiChiara CortinovisLinda ZardoBlal Adem Esmail","2020","http://link.springer.com/book/10.1007/978-3-030-20024-4","Book"
"Deliberative Public Engagement with Science","SpringerBriefs in Psychology","","","","10.1007/978-3-319-78160-0","Dr. Lisa M. PytlikZilligDr. Myiah J. HutchensDr. Peter MuhlbergerDr. Frank J. GonzalezDr. Alan J. Tomkins","2018","http://link.springer.com/book/10.1007/978-3-319-78160-0","Book"
"The Climate-Smart Agriculture Papers","","","","","10.1007/978-3-319-92798-5","Todd S. RosenstockAndreea NowakEvan Girvetz","2019","http://link.springer.com/book/10.1007/978-3-319-92798-5","Book"
"Contemporary Nordic Literature and Spatiality","Geocriticism and Spatial Literary Studies","","","","10.1007/978-3-030-23353-2","Kristina MalmioKaisa Kurikka","2020","http://link.springer.com/book/10.1007/978-3-030-23353-2","Book"
"Scaling of Differential Equations","Simula SpringerBriefs on Computing","","","","10.1007/978-3-319-32726-6","Hans Petter LangtangenGeir K. Pedersen","2016","http://link.springer.com/book/10.1007/978-3-319-32726-6","Book"
"Security in Computer and Information Sciences","Communications in Computer and Information Science","","","","10.1007/978-3-319-95189-8","Prof. Dr. Erol GelenbePaolo CampegianiProf. Dr. Tadeusz CzachórskiSokratis K. KatsikasIoannis KomniosLuigi RomanoDr. Dimitrios Tzovaras","2018","http://link.springer.com/book/10.1007/978-3-319-95189-8","Book"
"Informatics in the Future","","","","","10.1007/978-3-319-55735-9","Hannes WerthnerFrank van Harmelen","2017","http://link.springer.com/book/10.1007/978-3-319-55735-9","Book"
"Urban Planning Against Poverty","Future City","","","","10.1007/978-3-030-28419-0","Prof. Dr. Jean-Claude Bolay","2020","http://link.springer.com/book/10.1007/978-3-030-28419-0","Book"
"Outsourcing Legal Aid in the Nordic Welfare States","","","","","10.1007/978-3-319-46684-2","Olaf Halvorsen RønningOle Hammerslev","2018","http://link.springer.com/book/10.1007/978-3-319-46684-2","Book"
"European Somalis' Post-Migration Movements","IMISCOE Research Series","","","","10.1007/978-3-319-95660-2","Dr. Joëlle Moret","2018","http://link.springer.com/book/10.1007/978-3-319-95660-2","Book"
"Interferometry and Synthesis in Radio Astronomy","Astronomy and Astrophysics Library","","","","10.1007/978-3-319-44431-4","A. Richard ThompsonJames M. MoranGeorge W. Swenson Jr.","2017","http://link.springer.com/book/10.1007/978-3-319-44431-4","Book"
"Computing Characterizations of Drugs for Ion Channels and Receptors Using Markov Models","Lecture Notes in Computational Science and Engineering","","","","10.1007/978-3-319-30030-6","Aslak TveitoGlenn T. Lines","2016","http://link.springer.com/book/10.1007/978-3-319-30030-6","Book"
"Finance for Food","","","","","10.1007/978-3-642-54034-9","Doris Köhn","2014","http://link.springer.com/book/10.1007/978-3-642-54034-9","Book"
"Statistical Population Genomics","Methods in Molecular Biology","","","","10.1007/978-1-0716-0199-0","Julien Y. Dutheil","2020","http://link.springer.com/book/10.1007/978-1-0716-0199-0","Book"
"Tools and Algorithms for the Construction and Analysis of Systems","Lecture Notes in Computer Science","","","","10.1007/978-3-030-17502-3","Dirk BeyerProf. Dr. Marieke HuismanFabrice KordonProf. Bernhard Steffen","2019","http://link.springer.com/book/10.1007/978-3-030-17502-3","Book"
"3D Recording and  Interpretation for Maritime Archaeology","Coastal Research Library","","","","10.1007/978-3-030-03635-5","John K. McCarthyDr. Jonathan BenjaminTrevor WintonWendy van Duivenvoorde","2019","http://link.springer.com/book/10.1007/978-3-030-03635-5","Book"
"Plant Selection for Bioretention Systems and Stormwater Treatment Practices","SpringerBriefs in Water Science and Technology","","","","10.1007/978-981-287-245-6","William F. HuntBill LordBenjamin LohAngelia Sia","2015","http://link.springer.com/book/10.1007/978-981-287-245-6","Book"
"Pathways and Consequences of Legal Irregularity","IMISCOE Research Series","","","","10.1007/978-3-030-12088-7","Dr. Erik R. Vickstrom","2019","http://link.springer.com/book/10.1007/978-3-030-12088-7","Book"
"Leading in a VUCA World","Contributions to Management Science","","","","10.1007/978-3-319-98884-9","Prof. Jacobus (Kobus) KokDr. Steven C. van den Heuvel","2019","http://link.springer.com/book/10.1007/978-3-319-98884-9","Book"
"Earth Observation Open Science and Innovation","ISSI Scientific Report Series","","","","10.1007/978-3-319-65633-5","Dr. Pierre-Philippe MathieuDr. Christoph Aubrecht","2018","http://link.springer.com/book/10.1007/978-3-319-65633-5","Book"
"Invited Lectures from the 13th International Congress on Mathematical Education","ICME-13 Monographs","","","","10.1007/978-3-319-72170-5","Prof. Dr. Gabriele KaiserProf. Helen ForgaszProf. Mellony GravenProf. Dr. Alain KuzniakProf. Dr. Elaine SimmtProf. Binyan Xu","2018","http://link.springer.com/book/10.1007/978-3-319-72170-5","Book"
"The Future Internet","Lecture Notes in Computer Science","","","","10.1007/978-3-642-30241-1","Federico ÁlvarezFrances ClearyPetros DarasJohn DomingueAlex GalisAna GarciaAnastasius GavrasStamatis KarnourskosSrdjan KrcoMan-Sze LiVolkmar LotzHenning MüllerElio SalvadoriAnne-Marie SassenHans SchaffersBurkhard StillerGeorgios TselentisPetra TurkamaTheodore Zahariadis","2012","http://link.springer.com/book/10.1007/978-3-642-30241-1","Book"
"Educating Students to Improve the World","SpringerBriefs in Education","","","","10.1007/978-981-15-3887-2","Fernando M. Reimers","2020","http://link.springer.com/book/10.1007/978-981-15-3887-2","Book"
"Observing the Volcano World","Advances in Volcanology","","","","10.1007/978-3-319-44097-2","Carina J. FearnleyDeanne K. BirdKatharine HaynesWilliam J. McGuireGill Jolly","2018","http://link.springer.com/book/10.1007/978-3-319-44097-2","Book"
"AVENUE21. Automatisierter und vernetzter Verkehr: Entwicklungen des urbanen Europa","","","","","10.1007/978-3-662-61283-5","Dr. Mathias MittereggerEmilia M. BruckAggelos SoteropoulosAndrea SticklerProf. Dr. Martin BergerProf. Dr. Jens S. DangschatProf. Rudolf ScheuvensIan Banerjee","2020","http://link.springer.com/book/10.1007/978-3-662-61283-5","Book"
"Geographies of Schooling","Knowledge and Space","","","","10.1007/978-3-030-18799-6","Prof. Dr. Holger JahnkeProf. Dr. Caroline KramerProf. Dr. Peter Meusburger","2019","http://link.springer.com/book/10.1007/978-3-030-18799-6","Book"
"Protocols for Pre-Field Screening of Mutants for Salt Tolerance in Rice, Wheat and Barley","","","","","10.1007/978-3-319-26590-2","Souleymane BadoBrian P. ForsterAbdelbagi M.A. GhanimJoanna Jankowicz-CieslakGünter BertholdLiu Luxiang","2016","http://link.springer.com/book/10.1007/978-3-319-26590-2","Book"
"Musical Haptics","Springer Series on Touch and Haptic Systems","","","","10.1007/978-3-319-58316-7","Dr. Stefano PapettiCharalampos Saitis","2018","http://link.springer.com/book/10.1007/978-3-319-58316-7","Book"
"Nature-Based Flood Risk Management on Private Land","","","","","10.1007/978-3-030-23842-1","Thomas HartmannProf. Lenka SlavíkováSimon McCarthy","2019","http://link.springer.com/book/10.1007/978-3-030-23842-1","Book"
"Belly-Rippers, Surgical Innovation and the Ovariotomy Controversy","Medicine and Biomedical Sciences in Modern History","","","","10.1007/978-3-319-78934-7","Sally Frampton","2018","http://link.springer.com/book/10.1007/978-3-319-78934-7","Book"
"Design Science and Its Importance in the German Mathematics Educational Discussion","ICME-13 Topical Surveys","","","","10.1007/978-3-319-43542-8","Marcus NührenbörgerBettina Rösken-WinterChun Ip FungRalph SchwarzkopfErich Christian WittmannKathrin AkinwunmiFelix LensingFlorian Schacht","2016","http://link.springer.com/book/10.1007/978-3-319-43542-8","Book"
"Urbanization, Biodiversity and Ecosystem Services: Challenges and Opportunities","","","","","10.1007/978-94-007-7088-1","Thomas ElmqvistMichail FragkiasJulie GoodnessBurak GüneralpPeter J. MarcotullioRobert I. McDonaldSusan ParnellMaria ScheweniusMarte SendstadKaren C. SetoCathy Wilkinson","2013","http://link.springer.com/book/10.1007/978-94-007-7088-1","Book"
"Vermin, Victims and Disease","","","","","10.1007/978-3-030-19186-3","Dr. Angela Cassidy","2019","http://link.springer.com/book/10.1007/978-3-030-19186-3","Book"
"Multiculturalism and Conflict Reconciliation in the Asia-Pacific","","","","","10.1007/978-1-137-40360-5","Kosuke ShimizuWilliam S. Bradley","2014","http://link.springer.com/book/10.1007/978-1-137-40360-5","Book"
"Socio-Environmental Dynamics along the Historical Silk Road","","","","","10.1007/978-3-030-00728-7","Liang Emlyn YangHans-Rudolf BorkXiuqi FangSteffen Mischke","2019","http://link.springer.com/book/10.1007/978-3-030-00728-7","Book"
"Particle Accelerator Physics","Graduate Texts in Physics","","","","10.1007/978-3-319-18317-6","Helmut Wiedemann","2015","http://link.springer.com/book/10.1007/978-3-319-18317-6","Book"
"Institutional Reform for Innovation and Entrepreneurship","SpringerBriefs in Economics","","","","10.1007/978-3-319-55092-3","Niklas ElertMagnus HenreksonMikael Stenkula","2017","http://link.springer.com/book/10.1007/978-3-319-55092-3","Book"
"Advancing Culture of Living with Landslides","","","","","10.1007/978-3-319-59469-9","Kyoji SassaMatjaž MikošYueping Yin","2017","http://link.springer.com/book/10.1007/978-3-319-59469-9","Book"
"IMPROVE - Innovative Modelling Approaches for Production Systems to Raise Validatable Efficiency","Technologien für die intelligente Automation","","","","10.1007/978-3-662-57805-6","Prof. Dr. Oliver NiggemannDr. Peter Schüller","2018","http://link.springer.com/book/10.1007/978-3-662-57805-6","Book"
"Achieving the Paris Climate Agreement Goals","","","","","10.1007/978-3-030-05843-2","Sven Teske","2019","http://link.springer.com/book/10.1007/978-3-030-05843-2","Book"
"YOUMARES 8 – Oceans Across Boundaries: Learning from each other","","","","","10.1007/978-3-319-93284-2","Dr. Simon JungblutDr. Viola LiebichDr. Maya Bode","2018","http://link.springer.com/book/10.1007/978-3-319-93284-2","Book"
"Internal Diversity","Global Diversities","","","","10.1007/978-3-030-27790-1","Sonja Moghaddari","2020","http://link.springer.com/book/10.1007/978-3-030-27790-1","Book"
"Understanding Values Work","","","","","10.1007/978-3-030-37748-9","Harald AskelandGry EspedalBeate Jelstad LøvaasStephen Sirris","2020","http://link.springer.com/book/10.1007/978-3-030-37748-9","Book"
"Theories in and of Mathematics Education","ICME-13 Topical Surveys","","","","10.1007/978-3-319-42589-4","Angelika Bikner-AhsbahsAndreas VohnsOliver SchmittRegina BruderWilli Dörfler","2016","http://link.springer.com/book/10.1007/978-3-319-42589-4","Book"
"Wetlands and Water Framework Directive","GeoPlanet: Earth and Planetary Sciences","","","","10.1007/978-3-319-13764-3","Stefan IgnarMateusz Grygoruk","2015","http://link.springer.com/book/10.1007/978-3-319-13764-3","Book"
"Knowledge Solutions","","","","","10.1007/978-981-10-0983-9","Olivier Serrat","2017","http://link.springer.com/book/10.1007/978-981-10-0983-9","Book"
"The Interconnected Arctic — UArctic Congress 2016","Springer Polar Sciences","","","","10.1007/978-3-319-57532-2","Kirsi LatolaHannele Savela","2017","http://link.springer.com/book/10.1007/978-3-319-57532-2","Book"
"Climate-Smart Food","","","","","10.1007/978-3-030-18206-9","Prof. Dave Reay","2019","http://link.springer.com/book/10.1007/978-3-030-18206-9","Book"
"Model-Based Demography","Demographic Research Monographs","","","","10.1007/978-3-319-65433-1","Prof. Thomas K. Burch","2018","http://link.springer.com/book/10.1007/978-3-319-65433-1","Book"
"Open and Distance Education in Australia, Europe and the Americas","SpringerBriefs in Education","","","","10.1007/978-981-13-0298-5","Dr. Adnan QayyumDr. Olaf Zawacki-Richter","2018","http://link.springer.com/book/10.1007/978-981-13-0298-5","Book"
"Enabling Things to Talk","","","","","10.1007/978-3-642-40403-0","Alessandro BassiMartin BauerMartin FiedlerThorsten KrampRob van KranenburgSebastian LangeStefan Meissner","2013","http://link.springer.com/book/10.1007/978-3-642-40403-0","Book"
"Twitter als Basis wissenschaftlicher Studien","","","","","10.1007/978-3-658-14414-2","Fabian Pfaffenberger","2016","http://link.springer.com/book/10.1007/978-3-658-14414-2","Book"
"Cold Micro Metal Forming","Lecture Notes in Production Engineering","","","","10.1007/978-3-030-11280-6","Prof. Dr. Frank VollertsenDr. Sybille FriedrichProf. Dr. Bernd KuhfußProf. Dr. Peter MaaßDr. Claus ThomyProf. Dr. Hans-Werner Zoch","2020","http://link.springer.com/book/10.1007/978-3-030-11280-6","Book"
"Coming to Terms with Superdiversity","IMISCOE Research Series","","","","10.1007/978-3-319-96041-8","Dr. Peter ScholtenProf. Dr. Maurice CrulProf. Paul van de Laar","2019","http://link.springer.com/book/10.1007/978-3-319-96041-8","Book"
"Exploring Resilience","SpringerBriefs in Applied Sciences and Technology","","","","10.1007/978-3-030-03189-3","Siri WiigBabette Fahlbruch","2019","http://link.springer.com/book/10.1007/978-3-030-03189-3","Book"
"Tensor Network Contractions","Lecture Notes in Physics","","","","10.1007/978-3-030-34489-4","Assoc. Prof. Shi-Ju RanEmanuele TirritoDr. Cheng PengDr. Xi ChenDr. Luca TagliacozzoProf. Gang SuProf. Maciej Lewenstein","2020","http://link.springer.com/book/10.1007/978-3-030-34489-4","Book"
"The Responsible University","","","","","10.1007/978-3-030-25646-3","Dr. Mads P. SørensenLars GeschwindJouni KekäleProf. Rómulo Pinheiro","2019","http://link.springer.com/book/10.1007/978-3-030-25646-3","Book"
"Mercury Pollution in Minamata","SpringerBriefs in Environmental Science","","","","10.1007/978-981-10-7392-2","Prof. Hisashi Yokoyama","2018","http://link.springer.com/book/10.1007/978-981-10-7392-2","Book"
"Compartment Syndrome","","","","","10.1007/978-3-030-22331-1","MD Cyril MauffreyMD David J. HakMD Murphy P. Martin III","2019","http://link.springer.com/book/10.1007/978-3-030-22331-1","Book"
"Dissecting the Criminal Corpse","Palgrave Historical Studies in the Criminal Corpse and its Afterlife","","","","10.1057/978-1-137-58249-2","Elizabeth T. Hurren","2016","http://link.springer.com/book/10.1057/978-1-137-58249-2","Book"
"Fundamental Approaches to Software Engineering","Lecture Notes in Computer Science","","","","10.1007/978-3-319-89363-1","Dr. Alessandra RussoAndy Schürr","2018","http://link.springer.com/book/10.1007/978-3-319-89363-1","Book"
"Bio-based Building Skin","Environmental Footprints and Eco-design of Products and Processes","","","","10.1007/978-981-13-3747-5","Dr. Anna SandakDr. Jakub SandakDr. Marcin BrzezickiDr. Andreja Kutnar","2019","http://link.springer.com/book/10.1007/978-981-13-3747-5","Book"
"Häuser machen Schule","Rekonstruktive Bildungsforschung","","","","10.1007/978-3-658-26653-0","Dr. Jan Egger","2019","http://link.springer.com/book/10.1007/978-3-658-26653-0","Book"
"Fading Foundations","Synthese Library","","","","10.1007/978-3-319-58295-5","David AtkinsonJeanne Peijnenburg","2017","http://link.springer.com/book/10.1007/978-3-319-58295-5","Book"
"Sago Palm","","","","","10.1007/978-981-10-5269-9","Prof. Dr. Hiroshi EharaProf. Dr. Yukio ToyodaDr. Dennis V. Johnson","2018","http://link.springer.com/book/10.1007/978-981-10-5269-9","Book"
"Die Big-Data-Debatte","","","","","10.1007/978-3-658-27258-6","Prof. Dr. Susanne KnorreProf. Horst Müller-PetersProf. Dr. Fred Wagner","2020","http://link.springer.com/book/10.1007/978-3-658-27258-6","Book"
"Magazines, Tourism, and Nation-Building in Mexico","Studies of the Americas","","","","10.1007/978-3-030-01003-4","Dr. Claire Lindsay","2019","http://link.springer.com/book/10.1007/978-3-030-01003-4","Book"
"Compendium for Early Career Researchers in Mathematics Education","ICME-13 Monographs","","","","10.1007/978-3-030-15636-7","Prof. Dr. Gabriele KaiserDr. Norma Presmeg","2019","http://link.springer.com/book/10.1007/978-3-030-15636-7","Book"
"History of Mathematics Teaching and Learning","ICME-13 Topical Surveys","","","","10.1007/978-3-319-31616-1","Alexander KarpFulvia Furinghetti","2016","http://link.springer.com/book/10.1007/978-3-319-31616-1","Book"
"Handbook of Vascular Biometrics","Advances in Computer Vision and Pattern Recognition","","","","10.1007/978-3-030-27731-4","Prof. Dr. Andreas UhlProf. Christoph BuschDr. Sébastien MarcelProf. Dr. Raymond Veldhuis","2020","http://link.springer.com/book/10.1007/978-3-030-27731-4","Book"
"Foundations of Quantum Theory","Fundamental Theories of Physics","","","","10.1007/978-3-319-51777-3","Klaas Landsman","2017","http://link.springer.com/book/10.1007/978-3-319-51777-3","Book"
